title,message,isLink,type
0.4.1 课表日历导出版,https://www.bilibili.com/video/BV1yC4y1n7Q8,true,应用
橘猫杯编程竞赛,来空间宣传一下橘猫杯
只要西电的ACMer都可以来参加 不要求msc社员）
第一届橘猫杯将于近期举行
该赛事将模仿粉兔杯的形式进行(1v1单挑 随机选一道一定难度的Codeforces题目 更快AC的选手获胜 视参赛人数可能会有小组赛）
这是本届MSC ACM组办的第一个活动 一项娱乐性质的比赛 欢迎各位积极参加喵~
有意向参赛的加群92616863,false,社团
计科学生学习指南,https://zhuanlan.zhihu.com/p/652836971,true,应用
补缴医保通知,11月19日之前可以缴纳，每人380块（除去陕西省内有补助的）。待遇享受期为2024年1月1日至12月31日（特别说明：2023级新生及上一年度未参保学生待遇享受期为2023年9月1日至2024年12月31日）。,false,学校
计科院24届就业冲刺,https://mp.weixin.qq.com/s/WiZ-Bq267Sy8-tOhTNWEKg,true,学校
2023-2024 校历,https://mp.weixin.qq.com/s/L_jXTqYC5DzzkgQQUDI6MQ,true,学校
